sentence,topic
"Il libro è un'opera di satira politica.","Libri"
"Il cielo è illuminato da un tramonto infuocato.","Meteo"
"L'econometria utilizza metodi statistici per analizzare dati economici.","Economia"
"Voglio imparare a fare i bao cinesi al vapore.","Cucina"
"Il giocatore di bocce ha fatto uno "striscio".","Sport"
"Il libro è un romanzo gotico ambientato in un castello isolato.","Libri"
"Oggi c'è una leggera pioggerellina.","Meteo"
"La storia del pensiero economico è affascinante.","Economia"
"Ho trovato una ricetta per un guacamole saporito.","Cucina"
"Il giocatore di freccette ha fatto un "double top".","Sport"
"Il libro è un romanzo storico ambientato nel Rinascimento.","Libri"
"La temperatura è piacevole e mite.","Meteo"
"L'organizzazione mondiale del commercio (OMC) regola il commercio internazionale.","Economia"
"Voglio provare a fare il kimchi coreano.","Cucina"
"Il giocatore di curling ha fatto un "take-out".","Sport"
"Il libro è un romanzo psicologico che esplora la mente del protagonista.","Libri"
"Oggi c'è un'alta concentrazione di polveri sottili.","Meteo"
"La teoria dell'offerta e della domanda è un concetto fondamentale in economia.","Economia"
"Ho trovato una ricetta per un dahl di lenticchie indiano.","Cucina"
"Il giocatore di polo ha fatto un "neck shot".","Sport"
"Il libro è un romanzo d'avventura ambientato in terre esotiche.","Libri"
"Il cielo è coperto da un velo di nubi alte.","Meteo"
"Il prodotto nazionale lordo (PNL) è un indicatore economico importante.","Economia"